[
  {
    "number": 1,
    "name": "Risk",
    "planet": "Saturn",
    "sign": "Aries",
    "suit_name": "Ambition",
    "sign_keyword": "Self-Will",
    "image_description": "A boy, worldly possessions over his shoulder, bravely passes a menacing bear. The North American Indian fetish is a protection against danger. A key symbolizes Aries' boldness in opening doors, and a starred tree the fruits of Martian courage.",
    "personal": "With the Saturn in Aries personality, individuality, initiative and activities which combine self-control and disciplined energetic work will make life achievements most possible. Saturn/Aries people rarely speak or act without having a definite decision in mind. They have good reasoning ability and are prepared to shoulder responsibility when necessary. People with this planet/sign combination are loners in that they, more often than not, prefer to get on with things without asking for the help or advice of others. For those with this aspect, there may be a call for great patience in situations in which the natural Arian desire for quick action is frustratingly restricted. The biggest danger comes when Aries' impetuosity gets the better of Saturn's restrictive common sense, and provokes risky actions that may or may not succeed: impetuous actions usually lead to frustrating hold-ups. In these instances, a good physical outlet for pent-up aggression comes in handy, such as the martial arts, in which discipline and natural energy combine.",
    "reading": "When this card is drawn in a reading, it indicates a tendency to take everything too seriously and shows that allowing a sense of humor to express itself in the current situation will not denigrate conscientious work in any way. It is time to relax and take a measured risk.",
    "events": "A justified risk taken to provoke new possibilities; a sudden regretted action after a long bout of concentrated and patient work; pushing oneself into a position of power through intense work."
  },
  {
    "number": 2,
    "name": "Ostentation",
    "planet": "Saturn",
    "sign": "Taurus",
    "suit_name": "Ambition",
    "sign_keyword": "Material Values",
    "image_description": "Venus rides a sea-bull surrounded by cherubim and dolphins. The planet Venus rules the sign of Taurus and represents the romantic, pleasure-loving nature of the sign. Above, a rich woman drives a golden chariot drawn by white bulls.",
    "personal": "For Saturn Taureans, ambition is served by the material achievements gained through a great ability to sense the value of things and also to make them grow. There is a powerful materialistic overtone to the Saturn/Taurus persona that can show as an obsessive concern for money, selfishness and a need to show off. A fear of losing face can override all other matters, and someone with this planet/sign combination is anxious to maintain the status quo at all costs. There is also, however, a romantic, even artistic overtone to this card that usually relates to abilities with money or personal profit. The nature of Saturn in any sign is to control, and when this combines with the stubborn and fixed nature of Taurus, it hardens the somewhat easy-going, pleasure-loving qualities of the sign. Saturn Taureans have a tendency to use other people's generosity or sponsorship to further their own needs.",
    "reading": "If this card appears in a reading in response to a question concerning possessions or finance, it indicates a steady and continuous improvement with a strong application to duty and responsibilities. It is significant of the Ostentation card that although one may be doing the right thing in terms of ambition and economics, it will not usually make the questioner very popular. With regard to timing, the effects of this card are not easy to throw off, and may maintain their pressure for a long period.",
    "events": "The temptation to scheme to gain a material advantage; choosing the most impressive, status-enhancing option; a large financial commitment."
  },
  {
    "number": 3,
    "name": "Concentration",
    "planet": "Saturn",
    "sign": "Gemini",
    "suit_name": "Ambition",
    "sign_keyword": "Mental Awareness",
    "image_description": "A star is centered in a delicate spider's web. The web signifies patience and concentration. Above, an imp cavorts astride a pair of tightly closed lips while seven swords dance dangerously around him.",
    "personal": "People with Saturn in Gemini show a capacity for good, disciplined thinking and reasoning. With Saturn, the desire to achieve is foremost, and the Gemini talents combine to find quick and appropriate answers. The need to appear to be the right person in every ambitious situation can sometimes lead to bluff and name-dropping. Practical and systematic, Saturn/Gemini people are persistent in solving tricky problems. When it comes to looking after their own matters, clarity in contracts and agreements are of importance to Saturn Geminians, for they need to know precisely where they stand. They often have a talent for mathematics and science, and the painstaking attitude that goes with this kind of activity. Most of the information they require is geared to their career and ambition. Technical books and biographies of the famous are likely to be more important on their shelves than fiction. Negatively, people with this planet/sign combination, although basically resourceful and flexible, tend to be over-suspicious, hypercritical and twitchy.",
    "reading": "In a reading, this card suggests a situation full of distractions and unnecessary complications; only by keeping conscientiously to the essence of the matter will the questioner arrive at a successful conclusion. Because Gemini rules the Third House, the card can indicate strain in the questioner's relationship with siblings.",
    "events": "Talking one's way into an important job; using much concentrated research to achieve something, long conscientious study; ignoring someone's deliberate distractions."
  },
  {
    "number": 4,
    "name": "Charity",
    "planet": "Saturn",
    "sign": "Cancer",
    "suit_name": "Ambition",
    "sign_keyword": "Nurturing Attachment",
    "image_description": "A mother with her two children moves protectively away from a large impressive but severe building. In the sky, angels reach out in sympathy to the three figures.",
    "personal": "People with Saturn in the sign of Cancer show responsibility and self-discipline where family matters are concerned. Often this planet/sign combination indicates people whose own early environment may have been harsh or severe, and who may still have a few emotional scars. For this reason, it is more than usually important that the people this card describes improve their own family's circumstances, although real home comforts and security are likely to come later in life. There will be periods during which Saturn Cancerians feel emotionally isolated from the family, or may have to take on extra responsibility. Whatever this may be, they take family and social responsibilities seriously, valuing stability and security. Negatively, however, this can produce over-possessiveness towards material things and loved ones. Conscientious work in caring for or helping others will prove fulfilling throughout life for Saturn Cancerians. Often this planet/sign combination indicates the need for much hard work to keep up required standards of security and comfort. Nevertheless, feelings are hidden from public view to maintain dignity – Saturn/Cancer people suffer conflicting moods that manifest as difficulty in expressing feelings for fear of losing dignity.",
    "reading": "When this card is revealed in a reading, it can indicate a struggle to maintain family or home security. It may involve accepting reluctantly the material assistance of an institution.",
    "events": "Work for a charity or institution; a responsible post in which one is rewarded for good works; rewards for social work; foster parenting."
  },
  {
    "number": 5,
    "name": "Generosity",
    "planet": "Saturn",
    "sign": "Leo",
    "suit_name": "Ambition",
    "sign_keyword": "Creative Self-Expression",
    "image_description": "An enthusiastic speaker addresses a large gathering, passing on the words of a great prophet of the past. The image of the prophet sits above, as an inspiration for the performance of the speaker.",
    "personal": "Saturn Leos are strongly driven to use their tenacity and self-discipline in showy generosity that leads towards recognition and a better position in life. Generally their ambition, which has behind it the possibility of artistic potential, will seek some kind of showy creative outlet, and they can be successful professionally in entertainment, management, creative or educational roles. Saturn lions are best when not guarding their creative talents. People with this planet/sign combination need to gain the respect and even admiration of others, but there is a danger that this can push them into over-bearing behavior or into approval-seeking. Alternatively, they may have a tendency to be wary of expressing feelings or views until quite sure of the reception, which can lead to missed opportunities. This card indicates the possibility of a romantic involvement with someone much older or more experienced. Negatively, people with this aspect may need to deal with disappointment in creative or love matters. This is made easier when they bring themselves to reach out for help from others: in relationships, Saturn Leos have a certain reserved, suffering-in-seclusion quality that is not helpful.",
    "reading": "When Saturn in Leo is drawn, the subject of the reading has much creative joy to share; if this is offered with no strings attached, the chances of a successful outcome are assured.",